{
  "name": "Compact Brand",
  "cluster": "botanical-fresh",
  "harmony": "analogous",
  "palette": [
    { "role": "primary", "name": "fern", "anchor": { "l": 0.7, "c": 0.16, "h": 160, "alpha": 1 } },
    {
      "role": "secondary",
      "name": "lagoon",
      "anchor": { "l": 0.7, "c": 0.136, "h": 195, "alpha": 1 }
    },
    { "role": "accent", "name": "moss", "anchor": { "l": 0.7, "c": 0.136, "h": 125, "alpha": 1 } }
  ],
  "rampSteps": 9,
  "neutralHue": 160,
  "neutralChroma": 0.012,
  "typography": {
    "fontFamily": "Inter, system-ui, sans-serif",
    "baseSizePx": 16,
    "ratio": 1.25,
    "baseLineHeight": 1.25
  },
  "spacingBasePx": 4,
  "density": "compact",
  "radius": {
    "sm": 4,
    "md": 8,
    "lg": 16,
    "full": 9999
  },
  "targets": {
    "minWcagRatio": 4.5
  }
}
